[
  {
    "slug": "a-hankin-company",
    "name": "A. Hankin & Company",
    "manufacturer_slug": "hankin",
    "year_start": 1978,
    "year_end": 1981
  },
  {
    "slug": "allied-leisure-industries-incorporated",
    "name": "Allied Leisure Industries, Incorporated",
    "manufacturer_slug": "allied-leisure",
    "year_start": 1972,
    "year_end": 1979
  },
  {
    "slug": "alvin-g-and-company",
    "name": "Alvin G. and Company",
    "manufacturer_slug": "alvin-g",
    "year_start": 1991,
    "year_end": 1994
  },
  {
    "slug": "american-pinball-inc",
    "name": "American Pinball Inc.",
    "manufacturer_slug": "american-pinball",
    "year_start": 2016
  },
  {
    "slug": "arkon-automaten-gmbh",
    "name": "Arkon Automaten, GmbH",
    "manufacturer_slug": "arkon",
    "year_start": 1980,
    "year_end": 1982
  },
  {
    "slug": "atari-incorporated",
    "name": "Atari, Incorporated",
    "manufacturer_slug": "atari",
    "year_start": 1976,
    "year_end": 1983
  },
  {
    "slug": "bally-manufacturing-corporation",
    "name": "Bally Manufacturing Corporation",
    "manufacturer_slug": "bally",
    "year_start": 1931,
    "year_end": 1983
  },
  {
    "slug": "bally-midway-manufacturing-company",
    "name": "Bally Midway Manufacturing Company",
    "manufacturer_slug": "bally",
    "year_start": 1983,
    "year_end": 1988
  },
  {
    "slug": "bally-wulff",
    "name": "Bally Wulff",
    "manufacturer_slug": "bally",
    "year_start": 1986,
    "year_end": 1987
  },
  {
    "slug": "briarwood-a-division-of-brunswick-manufacturing-company",
    "name": "Briarwood, A Division Of Brunswick Manufacturing Company",
    "manufacturer_slug": "briarwood",
    "year_start": 1976,
    "year_end": 1980
  },
  {
    "slug": "brunswick-manufacturing-company",
    "name": "Brunswick Manufacturing Company",
    "manufacturer_slug": "brunswick",
    "year_start": 1932,
    "year_end": 1980
  },
  {
    "slug": "capcom-coin-op-incorporated",
    "name": "Capcom Coin-Op, Incorporated",
    "manufacturer_slug": "capcom",
    "year_start": 1995,
    "year_end": 1996
  },
  {
    "slug": "centro-matic-sa",
    "name": "Centro Matic S.A.",
    "manufacturer_slug": "centro-matic",
    "year_start": 1973,
    "year_end": 1978
  },
  {
    "slug": "chicago-coin-machine-manufacturing-company",
    "name": "Chicago Coin Machine Manufacturing Company",
    "manufacturer_slug": "chicago-coin",
    "year_start": 1932,
    "year_end": 1977
  },
  {
    "slug": "chicago-coin-machinery-company",
    "name": "Chicago Coin Machinery Company",
    "manufacturer_slug": "chicago-coin",
    "year_start": 1932
  },
  {
    "slug": "chicago-gaming-company",
    "name": "Chicago Gaming Company",
    "manufacturer_slug": "chicago-gaming",
    "year_start": 2003
  },
  {
    "slug": "costruzioni-elettroniche-automatiche",
    "name": "Costruzioni Elettroniche Automatiche",
    "manufacturer_slug": "cea",
    "year_start": 1977,
    "year_end": 1979
  },
  {
    "slug": "d-gottlieb-company-a-columbia-pictures-industries-company",
    "name": "D. Gottlieb & Company, a Columbia Pictures Industries Company",
    "manufacturer_slug": "gottlieb",
    "year_start": 1977,
    "year_end": 1983
  },
  {
    "slug": "d-gottlieb-company",
    "name": "D. Gottlieb & Company",
    "manufacturer_slug": "gottlieb",
    "year_start": 1931,
    "year_end": 1977
  },
  {
    "slug": "data-east-pinball-incorporated",
    "name": "Data East Pinball, Incorporated",
    "manufacturer_slug": "data-east",
    "year_start": 1986,
    "year_end": 1994
  },
  {
    "slug": "day-one-pinball-manufacturing-incorporated",
    "name": "Day One Pinball Manufacturing, Incorporated",
    "manufacturer_slug": "day-one",
    "year_start": 2015,
    "year_end": 2015
  },
  {
    "slug": "dennard-williams-dennard",
    "name": "Dennard-Williams & Dennard",
    "manufacturer_slug": "williams",
    "year_start": 1933,
    "year_end": 1933
  },
  {
    "slug": "dutch-pinball",
    "name": "Dutch Pinball",
    "manufacturer_slug": "dutch-pinball",
    "year_start": 2014,
    "year_end": 2014
  },
  {
    "slug": "exhibit-supply-company",
    "name": "Exhibit Supply Company",
    "manufacturer_slug": "exhibit",
    "year_start": 1932,
    "year_end": 1957
  },
  {
    "slug": "game-plan-incorporated",
    "name": "Game Plan, Incorporated",
    "manufacturer_slug": "game-plan",
    "year_start": 1978,
    "year_end": 1985
  },
  {
    "slug": "geiger-automatenbau-gmbh",
    "name": "Geiger-Automatenbau GmbH",
    "manufacturer_slug": "geiger",
    "year_start": 1978,
    "year_end": 1992
  },
  {
    "slug": "genco-manufacturing-company",
    "name": "Genco Manufacturing Company",
    "manufacturer_slug": "genco",
    "year_start": 1931,
    "year_end": 1958
  },
  {
    "slug": "grand-products-incorporated",
    "name": "Grand Products Incorporated",
    "manufacturer_slug": "grand-products",
    "year_start": 1986
  },
  {
    "slug": "haggis-pinball",
    "name": "Haggis Pinball",
    "manufacturer_slug": "haggis",
    "year_start": 2021
  },
  {
    "slug": "homepin-ltd",
    "name": "Homepin Ltd",
    "manufacturer_slug": "homepin",
    "year_start": 2018,
    "year_end": 2018
  },
  {
    "slug": "interflip-s-a",
    "name": "Interflip S. A.",
    "manufacturer_slug": "interflip"
  },
  {
    "slug": "j-h-keeney-and-company-incorporated",
    "name": "J. H. Keeney and Company Incorporated",
    "manufacturer_slug": "keeney",
    "year_start": 1934,
    "year_end": 1964
  },
  {
    "slug": "jersey-jack-pinball-inc-elk-grove-village-il",
    "name": "Jersey Jack Pinball, Inc. (Elk Grove Village, IL)",
    "manufacturer_slug": "jersey-jack",
    "year_start": 2020
  },
  {
    "slug": "jersey-jack-pinball-inc-lakewood-nj",
    "name": "Jersey Jack Pinball, Inc. (Lakewood, NJ)",
    "manufacturer_slug": "jersey-jack",
    "year_start": 2013,
    "year_end": 2019
  },
  {
    "slug": "joctronic-juegos-electronicos-sa",
    "name": "Joctronic Juegos Electronicos S.A.",
    "manufacturer_slug": "joctronic",
    "year_start": 1986,
    "year_end": 1987
  },
  {
    "slug": "keeney-and-sons",
    "name": "Keeney and Sons",
    "manufacturer_slug": "keeney",
    "year_start": 1931,
    "year_end": 1932
  },
  {
    "slug": "l-v-mambelli",
    "name": "L & V Mambelli",
    "manufacturer_slug": "mambelli"
  },
  {
    "slug": "maquinas-automaticas-computerizadas-sa",
    "name": "Maquinas Automaticas Computerizadas, S.A.",
    "manufacturer_slug": "mac-sa",
    "year_start": 1986,
    "year_end": 1987
  },
  {
    "slug": "maquinas-recreativas-sociedad-anonima",
    "name": "Maquinas Recreativas Sociedad Anonima",
    "manufacturer_slug": "maresa"
  },
  {
    "slug": "marvel-manufacturing-company",
    "name": "Marvel Manufacturing Company",
    "manufacturer_slug": "marvel",
    "year_start": 1944,
    "year_end": 1948
  },
  {
    "slug": "midway-manufacturing-company-a-subsidiary-of-wms-industries-incorporated",
    "name": "Midway Manufacturing Company, a subsidiary of WMS Industries, Incorporated",
    "manufacturer_slug": "bally",
    "year_start": 1988,
    "year_end": 1999
  },
  {
    "slug": "midway-manufacturing-company",
    "name": "Midway Manufacturing Company",
    "manufacturer_slug": "midway",
    "year_start": 1959,
    "year_end": 1978
  },
  {
    "slug": "midway-pattern-company",
    "name": "Midway Pattern Company",
    "manufacturer_slug": "midway",
    "year_start": 1932
  },
  {
    "slug": "mm-computer-games",
    "name": "MM Computer Games",
    "manufacturer_slug": "manilamatic"
  },
  {
    "slug": "mr-game",
    "name": "Mr. Game",
    "manufacturer_slug": "mr-game",
    "year_start": 1988,
    "year_end": 1990
  },
  {
    "slug": "multimorphic-inc",
    "name": "Multimorphic, Inc.",
    "manufacturer_slug": "multimorphic",
    "year_start": 2017
  },
  {
    "slug": "mylstar-electronics-incorporated",
    "name": "Mylstar Electronics, Incorporated",
    "manufacturer_slug": "gottlieb",
    "year_start": 1983,
    "year_end": 1984
  },
  {
    "slug": "northwestern-mail-box-company",
    "name": "Northwestern Mail Box Company",
    "manufacturer_slug": "stern-electronics",
    "year_start": 1932,
    "year_end": 1933
  },
  {
    "slug": "nsm-apparatebau-kg",
    "name": "NSM Apparatebau KG",
    "manufacturer_slug": "nsm"
  },
  {
    "slug": "nsmlowen",
    "name": "NSM/Löwen",
    "manufacturer_slug": "nsm",
    "year_start": 1985,
    "year_end": 1985
  },
  {
    "slug": "nuova-bell-games",
    "name": "Nuova Bell Games",
    "manufacturer_slug": "bell-games",
    "year_start": 1985,
    "year_end": 1988
  },
  {
    "slug": "playmatic",
    "name": "Playmatic",
    "manufacturer_slug": "playmatic",
    "year_start": 1968,
    "year_end": 1987
  },
  {
    "slug": "premier-technology",
    "name": "Premier Technology",
    "manufacturer_slug": "gottlieb",
    "year_start": 1984,
    "year_end": 1996
  },
  {
    "slug": "quetzal-pinball",
    "name": "Quetzal Pinball",
    "manufacturer_slug": "quetzal",
    "year_start": 2015
  },
  {
    "slug": "rally-aka-rally-play-company",
    "name": "Rally a.k.a. Rally Play Company",
    "manufacturer_slug": "rally",
    "year_start": 1961,
    "year_end": 1969
  },
  {
    "slug": "recel-s-a",
    "name": "Recel S. A.",
    "manufacturer_slug": "recel",
    "year_start": 1974,
    "year_end": 1986
  },
  {
    "slug": "recel-sa",
    "name": "Recel S.A.",
    "manufacturer_slug": "recel",
    "year_start": 1974,
    "year_end": 1986
  },
  {
    "slug": "renato-montanari-giochi",
    "name": "Renato Montanari Giochi",
    "manufacturer_slug": "rmg"
  },
  {
    "slug": "riot-pinball-llc",
    "name": "Riot Pinball, LLC",
    "manufacturer_slug": "riot-pinball",
    "year_start": 2015,
    "year_end": 2015
  },
  {
    "slug": "sega-enterprises-ltd",
    "name": "Sega Enterprises, Ltd.",
    "manufacturer_slug": "sega",
    "year_start": 1971,
    "year_end": 1979
  },
  {
    "slug": "sega-of-america",